sadness,fear,anger,joy
Here are some links for some guided meditations and podcasts that you may find interesting:,Owning It: The Anxiety Podcast -> https://open.spotify.com/show/5UsxoX6ikTr3ETvzQAHbdP,,
The Brain Warrior’s Way Podcast -> https://open.spotify.com/show/5tOtpZ6zWVUymZFiAugCeb,The Brain Warrior’s Way Podcast -> https://open.spotify.com/show/5tOtpZ6zWVUymZFiAugCeb,,
On Purpose with Jay Shetty -> https://open.spotify.com/show/5EqqB52m2bsr4k1Ii7sStc,,,
The Self Love Fix -> https://open.spotify.com/show/3WdMpEOWYl8Zx8uzzH8rAn,,,
Great Meditation -> https://www.youtube.com/c/GreatMeditation/videos,,,
The last one is my favourite!,,,
Feel free to try any episode and let me know which worked better for you!,,,
